{
  "version": "v0",
  "cases": [
    {
      "caseId": "case-vesl-demo-launch-001",
      "workspaceSlug": "launch-lab-private",
      "subjectSlug": "vesl-demo",
      "subjectName": "VESL Demo App",
      "subjectType": "nockapp",
      "customerLane": "builder-auditor",
      "status": "verified",
      "visibility": "public",
      "createdAt": "2026-06-05T18:00:00.000Z",
      "updatedAt": "2026-06-05T18:20:00.000Z",
      "requestedBy": "nocksperimental",
      "payment": { "status": "waived", "rail": "none", "amount": null, "currency": null, "reference": "founder-demo" },
      "evidenceIds": ["evidence-vesl-demo-lab-001", "evidence-vesl-demo-fakenet-001", "evidence-vesl-demo-vesl-001"],
      "reportSlug": "launch-vesl-demo-001",
      "badgeId": null
    },
    {
      "caseId": "case-payment-flow-prelaunch-001",
      "workspaceSlug": "launch-lab-private",
      "subjectSlug": "payment-flow",
      "subjectName": "Payment Flow NockApp",
      "subjectType": "nockapp",
      "customerLane": "builder-auditor",
      "status": "watch",
      "visibility": "shared-link",
      "createdAt": "2026-06-05T18:30:00.000Z",
      "updatedAt": "2026-06-05T18:45:00.000Z",
      "requestedBy": "nocksperimental",
      "payment": { "status": "quoted", "rail": "manual", "amount": 2500, "currency": "USD", "reference": "manual-quote-launch-001" },
      "evidenceIds": ["evidence-payment-flow-lab-001", "evidence-payment-flow-workspace-001"],
      "reportSlug": "launch-payment-flow-001",
      "badgeId": null
    }
  ],
  "submissions": [
    { "evidenceId": "evidence-vesl-demo-lab-001", "caseId": "case-vesl-demo-launch-001", "sourceKind": "lab", "sourceUrl": "/api/reports/generated/payment-flow", "submittedAt": "2026-06-05T18:05:00.000Z", "submittedBy": "nocklab", "status": "verified", "reportHash": "sha256:4cade57672628cbe3441d134eff67d6c589a8d94c70ff989a61da26d67430c91", "snapshotRoot": "3a6d6bff59cb624f", "receiptId": null, "redactionSummary": "No private keys, seeds, or environment dumps included." },
    { "evidenceId": "evidence-vesl-demo-fakenet-001", "caseId": "case-vesl-demo-launch-001", "sourceKind": "fakenet", "sourceUrl": "/api/fakenet/evidence", "submittedAt": "2026-06-05T18:08:00.000Z", "submittedBy": "fakenet-adapter", "status": "accepted", "reportHash": "sha256:8eb7d3fff4f531eaa72893ce022df3b196edb72278d5043619c25c37a8688044", "snapshotRoot": "local-fakenet-root-v0", "receiptId": null, "redactionSummary": "Wallet address and endpoint only; no signing material included." },
    { "evidenceId": "evidence-vesl-demo-vesl-001", "caseId": "case-vesl-demo-launch-001", "sourceKind": "vesl", "sourceUrl": "/api/vesl/evidence/submit", "submittedAt": "2026-06-05T18:12:00.000Z", "submittedBy": "vesl-test", "status": "verified", "reportHash": "sha256:vesl-demo-report-v0", "snapshotRoot": "vesl-demo-snapshot-root-v0", "receiptId": "vesl_submission_demo", "redactionSummary": "Lifecycle tags, peek status, and hull health only." },
    { "evidenceId": "evidence-payment-flow-lab-001", "caseId": "case-payment-flow-prelaunch-001", "sourceKind": "lab", "sourceUrl": "/api/reports/generated/payment-flow", "submittedAt": "2026-06-05T18:35:00.000Z", "submittedBy": "nocklab", "status": "verified", "reportHash": "sha256:4cade57672628cbe3441d134eff67d6c589a8d94c70ff989a61da26d67430c91", "snapshotRoot": "3a6d6bff59cb624f", "receiptId": null, "redactionSummary": "Generated report hash and snapshot root only." },
    { "evidenceId": "evidence-payment-flow-workspace-001", "caseId": "case-payment-flow-prelaunch-001", "sourceKind": "workspace-upload", "sourceUrl": "/api/workspaces/launch-lab-private/evidence", "submittedAt": "2026-06-05T18:40:00.000Z", "submittedBy": "workspace-upload-token", "status": "attention", "reportHash": "sha256:workspace-payment-flow-v0", "snapshotRoot": "workspace-payment-root-v0", "receiptId": null, "redactionSummary": "Upload policy accepted metadata; reviewer notes pending." }
  ],
  "reports": [
    {
      "reportSlug": "launch-vesl-demo-001",
      "caseId": "case-vesl-demo-launch-001",
      "summaryStatus": "verified",
      "score": 92,
      "requiredChecks": [
        { "id": "lab-report-linked", "label": "Lab report linked", "status": "pass", "summary": "Generated lab report hash and snapshot root are present." },
        { "id": "fakenet-evidence-linked", "label": "Fakenet evidence linked", "status": "pass", "summary": "Fakenet readiness evidence is attached to the case." },
        { "id": "vesl-lifecycle-linked", "label": "VESL lifecycle evidence linked", "status": "pass", "summary": "VESL evidence includes lifecycle checks and settlement effects." },
        { "id": "secret-redaction", "label": "Secret redaction", "status": "pass", "summary": "Submissions report no private keys, seeds, or API secrets." }
      ],
      "recommendedChecks": [
        { "id": "badge-ready", "label": "Badge ready", "status": "pass", "summary": "The case is eligible for public badge display." },
        { "id": "payment-rail", "label": "Payment rail", "status": "warn", "summary": "Payment was waived for this founder demo; paid rail metadata remains provider-neutral." }
      ],
      "evidenceSummary": "VESL Demo App has lab, fakenet, and VESL lifecycle evidence attached.",
      "reviewerNotes": "Founder demo proves Launch Evidence can aggregate existing Nocksperimental evidence primitives.",
      "publicSummary": "Launch evidence verified for a VESL-style NockApp lifecycle demo.",
      "generatedAt": "2026-06-05T18:20:00.000Z",
      "reportHash": "sha256:launch-vesl-demo-001",
      "snapshotRoot": "launch-vesl-demo-root-001"
    },
    {
      "reportSlug": "launch-payment-flow-001",
      "caseId": "case-payment-flow-prelaunch-001",
      "summaryStatus": "watch",
      "score": 78,
      "requiredChecks": [
        { "id": "lab-report-linked", "label": "Lab report linked", "status": "pass", "summary": "Generated payment-flow lab report is linked." },
        { "id": "workspace-upload-linked", "label": "Workspace upload linked", "status": "warn", "summary": "Workspace upload metadata is present but still needs reviewer confirmation." },
        { "id": "secret-redaction", "label": "Secret redaction", "status": "pass", "summary": "No secret-like material is referenced by the static case." }
      ],
      "recommendedChecks": [
        { "id": "vesl-lifecycle", "label": "VESL lifecycle", "status": "warn", "summary": "No VESL lifecycle receipt is linked yet." },
        { "id": "badge-ready", "label": "Badge ready", "status": "warn", "summary": "Badge issuance should wait for reviewer confirmation." }
      ],
      "evidenceSummary": "Payment Flow has lab evidence and workspace upload metadata, with reviewer confirmation pending.",
      "reviewerNotes": "Keep in watch state until lifecycle or reviewer evidence is attached.",
      "publicSummary": "Pre-launch payment-flow evidence is present but not badge-ready.",
      "generatedAt": "2026-06-05T18:45:00.000Z",
      "reportHash": "sha256:launch-payment-flow-001",
      "snapshotRoot": "launch-payment-flow-root-001"
    }
  ]
}
